[
  {
    "user_query": "Пожалуйста, предоставь краткую сводку по всем непрочитанным письмам за сегодня, с указанием отправителя, темы и срочности.",
    "style": "formal",
    "category": "information_search",
    "simulated_context_tokens": 5000,
    "agent_steps": 2,
    "tools_used": [
      "Mail"
    ],
    "estimated_manual_time_minutes": 15,
    "status": "success"
  },
  {
    "user_query": "эй агент дай мне краткое резюме по непрочитанным письмам за сегодня что там важно а что нет",
    "style": "voice",
    "category": "information_search",
    "simulated_context_tokens": 15000,
    "agent_steps": 3,
    "tools_used": [
      "Mail"
    ],
    "estimated_manual_time_minutes": 20,
    "status": "success"
  },
  {
    "user_query": "сводка по непрочитаным письмам за севодня кратко и структурированно",
    "style": "typo",
    "category": "information_search",
    "simulated_context_tokens": 2000,
    "agent_steps": 2,
    "tools_used": [
      "Mail"
    ],
    "estimated_manual_time_minutes": 10,
    "status": "success"
  },
  {
    "user_query": "Сформируй дайджест непрочитанных писем за сегодня: выдели самые важные, сгруппируй по проектам.",
    "style": "formal",
    "category": "information_search",
    "simulated_context_tokens": 30000,
    "agent_steps": 4,
    "tools_used": [
      "Mail",
      "Confluence"
    ],
    "estimated_manual_time_minutes": 25,
    "status": "success"
  },
  {
    "user_query": "слушай я опаздываю скажи кратко что пришло на почту сегодня непрочитанное",
    "style": "voice",
    "category": "information_search",
    "simulated_context_tokens": 8000,
    "agent_steps": 3,
    "tools_used": [
      "Mail"
    ],
    "estimated_manual_time_minutes": 18,
    "status": "error_tool"
  },
  {
    "user_query": "Сергей, найди в CRM контактное лицо компании ООО «Ромашка» и проверь, были ли у них выигранные сделки за последний год.",
    "style": "formal",
    "category": "information_search",
    "simulated_context_tokens": 15000,
    "agent_steps": 4,
    "tools_used": [
      "CRM"
    ],
    "estimated_manual_time_minutes": 20,
    "status": "success"
  },
  {
    "user_query": "агась слушй найди кто директор у этой фирмы из сиарэм и есть ли сделки там выиграные",
    "style": "voice",
    "category": "information_search",
    "simulated_context_tokens": 8000,
    "agent_steps": 3,
    "tools_used": [
      "CRM"
    ],
    "estimated_manual_time_minutes": 15,
    "status": "success"
  },
  {
    "user_query": "Серега, глянь в сиарэм по компании ООО Ромашка: кто директор и были ли выигранные сделки?",
    "style": "voice",
    "category": "information_search",
    "simulated_context_tokens": 12000,
    "agent_steps": 3,
    "tools_used": [
      "CRM"
    ],
    "estimated_manual_time_minutes": 15,
    "status": "success"
  },
  {
    "user_query": "найди в црм контакты директора компании ромашка и скажи есть ли выигранные сделки срочно",
    "style": "typo",
    "category": "information_search",
    "simulated_context_tokens": 10000,
    "agent_steps": 3,
    "tools_used": [
      "CRM"
    ],
    "estimated_manual_time_minutes": 20,
    "status": "success"
  },
  {
    "user_query": "Пожалуйста, извлеки из CRM последнюю информацию по компании «Ромашка»: ФИО генерального директора и список закрытых успешных сделок.",
    "style": "formal",
    "category": "information_search",
    "simulated_context_tokens": 20000,
    "agent_steps": 5,
    "tools_used": [
      "CRM",
      "Mail"
    ],
    "estimated_manual_time_minutes": 25,
    "status": "success"
  },
  {
    "user_query": "Please set up a periodic job to monitor emails that have been unanswered for over 2 hours and flag them for follow-up.",
    "style": "formal",
    "category": "task_management",
    "simulated_context_tokens": 5000,
    "agent_steps": 3,
    "tools_used": [
      "Mail"
    ],
    "estimated_manual_time_minutes": 45,
    "status": "success"
  },
  {
    "user_query": "can you like make a thing that checks my inbox every hour for emails i haven't replied to in more than two hours and then maybe send a reminder or something",
    "style": "voice",
    "category": "task_management",
    "simulated_context_tokens": 20000,
    "agent_steps": 4,
    "tools_used": [
      "Mail"
    ],
    "estimated_manual_time_minutes": 60,
    "status": "success"
  },
  {
    "user_query": "sete up a perriodic task to moniter emails with no responce for mor than 2 hour",
    "style": "typo",
    "category": "task_management",
    "simulated_context_tokens": 10000,
    "agent_steps": 2,
    "tools_used": [
      "Mail"
    ],
    "estimated_manual_time_minutes": 30,
    "status": "error_tool"
  },
  {
    "user_query": "I need a recurring task that scans all unread emails where the last reply from me is older than 2 hours and creates a ticket in Jira.",
    "style": "formal",
    "category": "task_management",
    "simulated_context_tokens": 80000,
    "agent_steps": 5,
    "tools_used": [
      "Mail",
      "Jira"
    ],
    "estimated_manual_time_minutes": 120,
    "status": "success"
  },
  {
    "user_query": "okay so I want an automated thing that looks through my mail and finds emails I didn't answer in two hours and then maybe like puts them in a list or sends a notification",
    "style": "voice",
    "category": "task_management",
    "simulated_context_tokens": 100000,
    "agent_steps": 6,
    "tools_used": [
      "Mail"
    ],
    "estimated_manual_time_minutes": 90,
    "status": "hallucination_loop"
  },
  {
    "user_query": "Необходимо получить полный список участников проектной команды по проекту 'Автоматизация логистики', а также указать, кто является ответственным за вендора-поставщика ПО.",
    "style": "formal",
    "category": "information_search",
    "simulated_context_tokens": 15000,
    "agent_steps": 5,
    "tools_used": [
      "CRM",
      "Confluence"
    ],
    "estimated_manual_time_minutes": 30,
    "status": "success"
  },
  {
    "user_query": "собери всю инфу по проектной команде проекту и скажи кто отвечает за вендора ну того который софт поставляет",
    "style": "voice",
    "category": "information_search",
    "simulated_context_tokens": 2500,
    "agent_steps": 4,
    "tools_used": [
      "CRM"
    ],
    "estimated_manual_time_minutes": 15,
    "status": "success"
  },
  {
    "user_query": "Собери кто входит в проектную команду и кто отвечает за вендора",
    "style": "typo",
    "category": "information_search",
    "simulated_context_tokens": 1000,
    "agent_steps": 3,
    "tools_used": [
      "Confluence"
    ],
    "estimated_manual_time_minutes": 10,
    "status": "success"
  },
  {
    "user_query": "Предоставьте детализированную информацию о составе рабочей группы проекта 'Цифровая трансформация' и персоне, ответственность за взаимодействие с внешним вендором (ООО 'ТехноПартнер').",
    "style": "formal",
    "category": "information_search",
    "simulated_context_tokens": 25000,
    "agent_steps": 6,
    "tools_used": [
      "CRM",
      "Confluence",
      "Mail"
    ],
    "estimated_manual_time_minutes": 45,
    "status": "success"
  },
  {
    "user_query": "найди состав по проекту и вендор ответственный кто будет подскажи",
    "style": "voice",
    "category": "information_search",
    "simulated_context_tokens": 1800,
    "agent_steps": 2,
    "tools_used": [],
    "estimated_manual_time_minutes": 5,
    "status": "success"
  },
  {
    "user_query": "Выгрузи данные по клиентам из CRM в Excel сводный отчет за последний месяц.",
    "style": "formal",
    "category": "data_analysis",
    "simulated_context_tokens": 45000,
    "agent_steps": 6,
    "tools_used": [
      "CRM",
      "Excel"
    ],
    "estimated_manual_time_minutes": 45,
    "status": "success"
  },
  {
    "user_query": "а выгрузика мне данные по клиентам из сиэрэм в эксель сделай отчет сводный ну там где видно",
    "style": "voice",
    "category": "data_analysis",
    "simulated_context_tokens": 12000,
    "agent_steps": 7,
    "tools_used": [
      "CRM",
      "Excel"
    ],
    "estimated_manual_time_minutes": 60,
    "status": "success"
  },
  {
    "user_query": "выгрузи данные по клиетнам из црм в сводный отчет эксел",
    "style": "typo",
    "category": "data_analysis",
    "simulated_context_tokens": 8000,
    "agent_steps": 5,
    "tools_used": [
      "CRM",
      "Excel"
    ],
    "estimated_manual_time_minutes": 40,
    "status": "success"
  },
  {
    "user_query": "Сформируй отчет Excel по клиентам из CRM: выбери поля: название, контакт, сумма сделок, дата регистрации. Сгруппируй по менеджерам.",
    "style": "formal",
    "category": "data_analysis",
    "simulated_context_tokens": 65000,
    "agent_steps": 8,
    "tools_used": [
      "CRM",
      "Excel"
    ],
    "estimated_manual_time_minutes": 90,
    "status": "success"
  },
  {
    "user_query": "экспортни мне клиентов из црм в эксельку только тех у кого просрочка больше 30 дней",
    "style": "typo",
    "category": "data_analysis",
    "simulated_context_tokens": 10000,
    "agent_steps": 4,
    "tools_used": [
      "CRM",
      "Excel"
    ],
    "estimated_manual_time_minutes": 30,
    "status": "error_tool"
  },
  {
    "user_query": "Найди, пожалуйста, свободную переговорную комнату на сегодня на 2 часа, вместимостью не менее 10 человек",
    "style": "formal",
    "category": "information_search",
    "simulated_context_tokens": 2500,
    "agent_steps": 3,
    "tools_used": [
      "Calendar",
      "Room booking system"
    ],
    "estimated_manual_time_minutes": 15,
    "status": "success"
  },
  {
    "user_query": "нужна комната для встречи человек 15 прямо сейчас есть свободная",
    "style": "voice",
    "category": "information_search",
    "simulated_context_tokens": 1200,
    "agent_steps": 2,
    "tools_used": [
      "Calendar"
    ],
    "estimated_manual_time_minutes": 10,
    "status": "success"
  },
  {